Amount,Applicant,Average,Beneficiary,Community_ID,Deviation,Frequency,Linkage
3158293.15,ZANIB INTERNATIONAL BUSINESS H # 133 D SHADMAN COLONY GUJRAT GUJRAT ,3158293.15,SUZHOU WUJIANG SHENZHOU BIMETALLIC CABLE COLTD XINTIANWAN INDUSTRIAL CENTER QIDU TOWNWUJIANGSUZHOUCHINA,90,,1,0
127137.63,GILANI CORPORATION 503 FIFTH FLOOR BURHANI MARKET OPPOSITE BVS SCHOOL A.H.RD KARACHI,127137.63,YUSEN LOGISTICS HK LTD 22F GOODMAN INTERLINK CENTRE39 TSING YI ROAD TSING YI NEW TERITORIES HONGKONG,94,,1,0
7723750.12,"ZANCTOK PHARMACEUTICAL LABORATORIES F/5 S.I.T.E. AREA HYDERABAD, PAKISTAN ",2574583.373,INFOARK CO LTD RM 810 NEW LAND PLAZA 58 FUCHENG ROAD HAIDIAN DISTRICT BEIJING CHINA,32,269150.9281,3,0
6037701.12,"ZANCTOK PHARMACEUTICAL LABORATORIES F/5 S.I.T.E. AREA HYDERABAD, PAKISTAN ",3018850.56,SHANGHAI YUKING WATER SOLUBLE MATERIAL TECH COLTD RM 4F13BNO600SOUTH XINYUAN RD 201306SHANGHAICHINA,32,0,2,0
2321789.58,"ZANCTOK PHARMACEUTICAL LABORATORIES F/5 S.I.T.E. AREA HYDERABAD, PAKISTAN ",2321789.58,SHOUGUANG FUKANG PHARMACEUTICAL CO LTD SHANDONG SHOUGUANG ECONOMY 7TECHNOLOGY DEVELOPMENT ZONE,32,,1,0
192171.86,RIKANS INTERNATIONAL PLAZA # 453 2ND FLOOR MAIN BLOULEVARD DHA LAHORE,64057.28667,DOOSAN INFRACORE CO LTD 1812 EULJIRO6GA JUNGGU SEOUL KOREA ,95,18771.77692,3,0
551883.62,"RONG WEI SILK ROAD INTL TRADING PVT HOUSE NO.95/1,STREET NO.31,PHASE 6, KHAYABAN E SEHAR,D.H.A, KARACHI",551883.62,SINOWORLD INTERNATIONAL CO LTD FLAT 8 20F SUNWISE INDUSTRIAL BUILDING 1626 WANG WO TSAI ST TSUEN WAN NT HONG KONG,59,,1,0
285113.66,"ROOMI ENTERPRISES (PVT) LTD PLOT NO 16, SECTOR-23 KORANGI INDUSTRIAL AREA. KARACHI",285113.66,GIVAUDAN UK LTD KENNINGTON ROADASHFORD KENT TN24 OLT UNITED KINGDOM,96,,1,0
959847.73,"ROOMI ENTERPRISES (PVT) LTD PLOT NO 16, SECTOR-23 KORANGI INDUSTRIAL AREA. KARACHI",959847.73,JIANGXI NEW JOURNEY IMPEXP COLTD RM315BLDG6 WAST HOPE ABILITY PARK NO185 ER QI RD NNANCHANG JIANGXI 330046,96,,1,0
8647790.93,"G M ENTERPRISES ROOM # 3,PLOT # 46/C, 2ND FLOOR,DOGAGE TOWN,MAIN BAZAR, BARKI ROAD,LAHORE.",4323895.465,CITY MOUNTAINS GENERAL TRADING LLC UAE ,3,800533.6677,2,0
149351866.3,"G M ENTERPRISES ROOM # 3,PLOT # 46/C, 2ND FLOOR,DOGAGE TOWN,MAIN BAZAR, BARKI ROAD,LAHORE.",24891977.72,LONDON SILK GENERAL TRADING (Multiple),3,10777686.54,6,0
32664120.3,"G M ENTERPRISES ROOM # 3,PLOT # 46/C, 2ND FLOOR,DOGAGE TOWN,MAIN BAZAR, BARKI ROAD,LAHORE.",16332060.15,NEW PROSPECT GENERAL TRADING LLC UAE ,3,656515.9639,2,0
1250149,FRUITICANA FOODS 09 EDEN VALUE HOMES BLOCK-A STREET NO-03 14-KM MULTAN ROAD LAHORE,625074.5,HOMEDIA ZHANGZHOU IMPORT AND EXPO CHENGTOU YUANDA BIHU PARK LONGWEN ,88,344801.5158,2,0
2220899.18,"YORKSHIRE TRADING INT PK G 27, BALOUR PALACE,MCLEOD ROAD LAHORE ",2220899.18,CHINA LINYI GLOBAL TRADE CENTER CO LTD INTERSECTION OF SHUAGLING ROAD AND HONGDA ROAD LINYI CITY SHANDONG PROVINCE,78,,1,0
1441291.5,"FIVE STAR AGRO CHEMICAL AND FERTILIZERS SUITE NO.3, 4TH FLOOR AMMAN BUSINESS CENTER, BLOCK H-3 JOHAR TOWN LAHORE",1441291.5,SAF SULPHER FACTORY POBOX 70482  RIYADH 11567 SAUDI ARABIA ,97,,1,0
225283190.5,AKHTAR ALI TRADING COMPANY H # 3 NEAR RAJA JAMIL OFFICE HAJI SULTAN MARKET BABU LAL HUSSAIN RD DHOK RATA RWP,16091656.47,HEBEI OUSHANG PHOTOVOLTAIC TECHNOLOGY CO LTD NORTHWET OF DAZHAO VILLAGE HEQU TOWNNINJGIN COUNTY XINGTAI,77,12158367.4,14,0
16487326.55,AKHTAR ALI TRADING COMPANY H # 3 NEAR RAJA JAMIL OFFICE HAJI SULTAN MARKET BABU LAL HUSSAIN RD DHOK RATA RWP,16487326.55,SHENZHEN YINGLI NEW ENERGY RESOURCE CO LTD 36F BUILDING NO1 HONGF HITECH INDUSTRIAL PARK INTERCHANGE OF GENYU ROAD AND NANMING ROAD CHIN,77,,1,0
76202391.86,AKHTAR ALI TRADING COMPANY H # 3 NEAR RAJA JAMIL OFFICE HAJI SULTAN MARKET BABU LAL HUSSAIN RD DHOK RATA RWP,6350199.322,ZHEJIANG PUJIANG YUHENG HARDWARE COLTD NO88 XINHGGONG ROAD HUANGZHI PUJIANG ZHEJIANG CHINA,77,7952285.43,12,0
36734589.54,EXCEL CORPORATION SUIT NO.127 EDAN CENTER JAIL ROAD LAHORE,12244863.18,GREAT FASHION TRADING LLC UAE ,3,3899179.274,3,0
41955943.15,EXCEL CORPORATION SUIT NO.127 EDAN CENTER JAIL ROAD LAHORE,20977971.58,LONDON SILK GENERAL TRADING (Multiple),3,1263445.789,2,0
88479470.1,EXCEL CORPORATION SUIT NO.127 EDAN CENTER JAIL ROAD LAHORE,11059933.76,NEW PROSPECT GENERAL TRADING LLC UAE ,3,7656639.385,8,0
19916028,SILVER LAKE FOODS PRODUCT LTD PLOT NO 69  PHASE 3 INDUSTRIAL ESTATE  HATTAR KHYBER PAKHTUNKHWA  PAKISTAN,19916028,DRAKE LOAD ENGINEERING EQUIPMENT TRADING LLC OFFICE NO 208 2ND FLOOR ARCADE BUILDING GARHOUD AREA POBOX 49207 DUBAI UAE,91,,1,0
51356203.56,SILVER LAKE FOODS PRODUCT LTD PLOT NO 69  PHASE 3 INDUSTRIAL ESTATE  HATTAR KHYBER PAKHTUNKHWA  PAKISTAN,5706244.84,GUM BASE CO SPA VIA NERVIANO 25 20020 LAINATE MI ITALY ,91,2929572.899,9,0
20759030.12,"CLOUD PACKAGING PVT LTD OFFICE NO  809,810 8TH FLOOR PLOT N 189/A BLOCK # A PORTWAY TRADE CENTR E SHAHRA E FAISAL KARACHI.PAKISTAN",1297439.383,DAETWYLER SWISS TEC AG FLUGPLATZ CH 3368 BLEIENBACH SWITZERLAND ,44,1424272.203,16,0
3352773.26,"CLOUD PACKAGING PVT LTD OFFICE NO  809,810 8TH FLOOR PLOT N 189/A BLOCK # A PORTWAY TRADE CENTR E SHAHRA E FAISAL KARACHI.PAKISTAN",419096.6575,HELL GRAVURE SYSTEMS PHILIPPREISWEG 5 24148 KIEL GERMANY ,44,268201.3785,8,0
1155628703,CHINA STATE CONSTRUCTION ENGINEERIN CORPORATION LTD PKM PJT 03 F6-4 JAM JAMIL MARAL HOUSE CANAL BANK KHANPUR ROAD RAHIM YAR KHAN,64201594.61,CHINA STATE CONSTRUCTION ENGINEERIN CORPLTD MANSION NO15 SANLIHE ROAD 100037 BEIJINGCHINA,98,81820188.49,18,0
424525.86,"ARIES PHARMACEUTICALS (PVT) LTD., 1-W, INDUSTRIAL ESTATE, HAYATABAD, PESHAWAR - PAKISTAN ",424525.86,HEER PHARMA PRIVATE LIMITED 317 UNIQUE INDUSTRIAL ESTATE OFF VS MARG TWIN TOWER LANE OPP SIDDHIVINAYAK TEMPLE PRABHADEVI,78,,1,0
3700188.36,"ARIES PHARMACEUTICALS (PVT) LTD., 1-W, INDUSTRIAL ESTATE, HAYATABAD, PESHAWAR - PAKISTAN ",1233396.12,HUBEI HONGYUAN PHARMACEUTICAL TECHNOLOGY CO LTD 428 YISHUI NORTH ROAD FENGSHAN LUOTIAN HUBEI CHINA,78,593081.7708,3,0
1905649.42,"ARIES PHARMACEUTICALS (PVT) LTD., 1-W, INDUSTRIAL ESTATE, HAYATABAD, PESHAWAR - PAKISTAN ",952824.71,ZHEJIANG MEDICINES AND HEALTH PRODUCTS IMP AND EXP CO LTD ZMC BUILDING1012NZHONGSHAN ROAD HANGZHOU 310003 CHINA,78,66707.8032,2,0
171336.54,SMZ APPAREL PVT LTD OFF BANK STOP 17 KM FEROZEPUR ROAD AZAM CHOWK ATTA BUKSH ROAD ATTARI SAROBA LAHORE,171336.54,APPAREL FASTENER HK LTD ROOM 702 7F FU FAI COMMERCIAL CE ,8,,1,0
1243177.34,SMZ APPAREL PVT LTD OFF BANK STOP 17 KM FEROZEPUR ROAD AZAM CHOWK ATTA BUKSH ROAD ATTARI SAROBA LAHORE,248635.468,METRO COMPANY (Multiple),8,136461.8177,5,0
131104.07,SMZ APPAREL PVT LTD OFF BANK STOP 17 KM FEROZEPUR ROAD AZAM CHOWK ATTA BUKSH ROAD ATTARI SAROBA LAHORE,131104.07,UNIQUE APPAREL PVT LIMITED NRA 2ND FLOOR UNIT NO 1 BUILDING NO 111 ,8,,1,1
7830143.64,"SNR COMPANY SHOP # 1, REHMAN ST. # 4, BRANDERTH ROAD, LAHORE.",1305023.94,QINGDAO AMINA INDUSTRIAL CO LTD ROOM 808 NO319 BUILDING ZERUN FINANCE PLAZA EAST CHANGJIANG ROAD ETDZ QINGDAO SHANDONG CHINA,37,479515.4607,6,0
7306037.64,"CHEM.TECH.INTERNATIONAL 2A-5C-6C-VALUE ADDITION CITY, KHURIANWALA,FAISALABAD. FAISALABAD.",3653018.82,AL NASSERIAH INTERNATIONAL FZE PO BOX 10559 RAS AL KHAIMAH UNITED ARAB EMIRATES ,99,2542308.5,2,0
643602.17,CAMTRONX CAMTRONX 55 CHAMBERLANE ROAD LAHORE LAHORE LAHORE,643602.17,BIN QUTAB LOGISTICS LLC OFFICE NO 109 DUSSELDORF BUSINESS P ,17,,1,0
2013615.25,CAMTRONX CAMTRONX 55 CHAMBERLANE ROAD LAHORE LAHORE LAHORE,2013615.25,COMPASS OCEAN LOGISTICS LLC PO BOX 262985 JEBEL ALI FREE ZONE SOUTH DUBAI UAE ,17,,1,0
1024626.18,CAMTRONX CAMTRONX 55 CHAMBERLANE ROAD LAHORE LAHORE LAHORE,1024626.18,NIKON MIDDLE EAST FZE PO BOX 261908 DUBAI UAE ,17,,1,0
2296155.56,"BRONX INTERNATIONAL BRONX INTERNATIONAL,45/46,MEZANINE FLOOR, BURHANI CENTRE, BOULTON MARKET, KARACHI.",382692.5933,NEW DIAMOND STAR GENERAL TRADING LLC DEIRA DUBAI UAE ,86,222305.4654,6,0
1695341.4,"BRONX INTERNATIONAL BRONX INTERNATIONAL,45/46,MEZANINE FLOOR, BURHANI CENTRE, BOULTON MARKET, KARACHI.",565113.8,RANO FASHION CO LLC PO BOX 78600 DUBAI UAE,86,272422.7139,3,0
12758556.84,BRISTOL MAYER BIOTECH PAKISTAN HOUSE # 73-B GULDUSHT TOWN ZARAR SHAHEED ROAD LAHORE CANTT,439950.2359,ALPHACAPS GMBH OSTRING 10 32832 AUGUSTDORT GERMAN ,100,230386.0403,29,0
48024.08,BRISTOL MAYER BIOTECH PAKISTAN HOUSE # 73-B GULDUSHT TOWN ZARAR SHAHEED ROAD LAHORE CANTT,48024.08,CREVIL COSMATICS AND PHARMACEUTICAL ISABELLASTR13 80798 MUNICH GERMAN ,100,,1,0
4554265.12,BRISTOL MAYER BIOTECH PAKISTAN BRISTOL MAYER BIOTECH PAKISTAN 73 B GULDASHT TOWN ZARRAR SHAHEED ROAD LAHORE,414024.1018,ALPHACAPS GMBH OSTRING 10 32832 AUGUSTDORT GERMAN ,100,161929.6463,11,0
123673.23,BRISTOL MAYER BIOTECH PAKISTAN BRISTOL MAYER BIOTECH PAKISTAN 73 B GULDASHT TOWN ZARRAR SHAHEED ROAD LAHORE,123673.23,CREVIL COSMATICS AND PHARMACEUTICAL ISABELLASTR13 80798 MUNICH GERMAN ,100,,1,0
371223.23,TEFLON METAL WARE INDUSTRIES TEFLON METAL WARE INDUSTRIES 15-A SMALL INDUSTRIES ESTATE NO 2 GUJRANWALA,371223.23,BEST TRUST EXP & IMP CO LTD 1611 RM 16F GUOMAO BUILDINGG # 999 ,101,,1,0
174295.64,TAJ COMPANY PVT LTD AIWAN E ILAM PLAZA 18 URDU BAZAR LAHORE,58098.54667,QINGDAO ALFAJAR INTERNATIONAL CO LTD HUANGDAO LUSHAN ROA 77 NUMBER 603 QINGDAO CHINA ,7,5297.908361,3,0
463602.16,T A INTERNATIONAL GALI MUHAMMAD YOUSAF WALI MOHALLAH KOKHARIKE NEAR NAIMAT ULLAH DAKAN DAAR GUJRANWALA.,463602.16,YONGKANG HUAYING WEIGHING APPARATUS CO LTD CHINA ,7,,1,0
1487398.96,SYNTHETIC PRODUCTS ENTERRISES LTD 127-S QUAIED E AZAM INDUSTRIAL ESTATE TOWNSHIP KOTLAKHPAT LAHORE,743699.48,HUSKY INJECTION MOLDING SYSTEMS SA TECHNICAL CENTRE BLDG 1 BP 93 ZI ,102,85354.7747,2,0
3573983.64,TALHA TRADERS 89-L MODER TOWN EXT LAHORE ,3573983.64,LONGYOU MEIXU TRADING CO LTD NO1 LIUYUAN RD LONGZHOU STREET LINHIANG INDUSTRIAL DIST LONGYOU CHINA,17,,1,0
11849600.6,TALHA TRADERS 89-L MODER TOWN EXT LAHORE ,2962400.15,YIWU RIGHTWAY IMPORT AND EXPORT CO 500 CHOUZHOU NORTH ROAD YIWU ZHJIA ,17,753963.3022,4,0
9154050.07,TALHA TRADERS 89-L MODER TOWN EXT LAHORE ,2288512.518,YIWU SUNSHIME IMP AND EXP CO LIMITED OFFICE 1011 JINMAO TOWER CHOUZHOU ROAD YIWU CITY ZHEJIANG CHINA,17,575832.807,4,0
135533130.3,ARAN MART INTERNATIONAL ROOM NO 3 SECOND FLOOR PLOT 46/C  DOGAGE TOWN MAIN BAZAR BARKI ROAD LAHORE.,27106626.05,GREAT FASHION TRADING LLC UAE ,3,3155637.382,5,0
26915840.99,ARAN MART INTERNATIONAL ROOM NO 3 SECOND FLOOR PLOT 46/C  DOGAGE TOWN MAIN BAZAR BARKI ROAD LAHORE.,26915840.99,SHAOXING KEQIAO DOUFO IMP AND EXP CO LTD CHINA ,3,,1,0
152042469.3,ARAN MART INTERNATIONAL ROOM NO 3 SECOND FLOOR PLOT 46/C  DOGAGE TOWN MAIN BAZAR BARKI ROAD LAHORE.,25340411.54,VALDA INTERNATIONAL GENERAL TRADING LLC DEIRA DUBAI UAE ,3,4572936.393,6,0
5572294.99,"TARIQ GLASS INDUSTRIES LIMITED HEAD OFFICE 128-J MODEL TOWN, LAHORE,PAKISTAN ",5572294.99,ESSA HAMZA TRADING LLC PO BOX 86851 AL AWEER DUBAI UAE ,1,,1,0
34828319.58,"ATLAS METALS (PRIVATE) LIMITED 2ND FLOOR, FEDERATION HOUSE SHARAE FIRDOUSI, CLIFTON KARACHI-75600, PAKISTAN",11609439.86,ATLAS GLOBAL FZE OFFICE 323 BLOCK B TECHNO PARK BUILDING SHEIKH MOHAMMED BIN ZAYED ROAD DUBAI POBOX 17442 UAE,25,264104.2737,3,0
1452821.83,SUPER ENTERPRISES SUPER ENTERPRISES 55-CHAMBERLANE ROAD LAHORE ,1452821.83,BIN QUTAB LOGISTICS LLC OFFICE NO 109 DUSSELDORF BUSINESS P ,17,,1,0
1251565.13,SUPER ENTERPRISES SUPER ENTERPRISES 55-CHAMBERLANE ROAD LAHORE ,1251565.13,NIKON MIDDLE EAST FZE PO BOX 261908 DUBAI UAE ,17,,1,0
9541297.32,SUN STAR TRADERS HOUSE NO 9A ST NO 13 KOTLI PEER ABDUL REHMAN LAHORE DAK KHANA BAGHBAN PURA LAHORE,4770648.66,DEERFOS CO LTD 52 GAJWARO 83 BEONGIL SEOGU INCHEON KOREA ,103,444385.1457,2,0
8986363.4,SWAT AGRO CHEMICALS 216 BLOCK-DD PHASE-IV DHA CANTT LAHORE ,8986363.4,AMVAC NETHERLANDS BV KOKERMOLEN 5 3994 DG HOUTEN THE N ,104,,1,0
9069130.23,SWAT AGRO CHEMICALS 216 BLOCK-DD PHASE-IV DHA CANTT LAHORE ,4534565.115,CHEMINOVA AS POST BOX 9  DK7620 LEMVIG DENMARK ,104,1182951.709,2,0
999697.58,SWAT AGRO CHEMICALS 216 BLOCK-DD PHASE-IV DHA CANTT LAHORE ,999697.58,COMPO EXPERT GMBH GILDENSTRASSE 38 48157 MUENSTER GERMANY,104,,1,0
71663.11,COMET SPORTS PVT LTD COMET SPORTS SHAHAB PURA ROAD SHAHAB PURA NEAR SMALL INDUSTRIAL ESTATE SIALKOT,71663.11,DONMING GROUP LIMITED ROOM7094TOWER II SILVERCORD30 CANTON ROADTSIMHARSUIKOWLOON HONG KONG,85,,1,0
3695471.41,COMET SPORTS PVT LTD COMET SPORTS SHAHAB PURA ROAD SHAHAB PURA NEAR SMALL INDUSTRIAL ESTATE SIALKOT,3695471.41,HUI ZHOU DA YA WAN JIAN XING STICKY RIBBON CO LTDDA YA XIANGSHUI RIVER INDUSTRIAL ZONE HUIZHOU GUANGDONG PROVINCE CHINA,85,,1,0
12436982.97,"ESSO CO INTERNATIONAL PLOT # M-11-E 188,BLOCK -B, ST # 43,ROOM 2,46/C,2ND,FLOOR, DOGER TOWN MAIN BAZAR,BARKI RD,LHR",12436982.97,GREAT FASHION TRADING LLC UAE ,3,,1,0
56924200.88,"ESSO CO INTERNATIONAL PLOT # M-11-E 188,BLOCK -B, ST # 43,ROOM 2,46/C,2ND,FLOOR, DOGER TOWN MAIN BAZAR,BARKI RD,LHR",28462100.44,LONDON SILK GENERAL TRADING (Multiple),3,2030882.008,2,0
66047517.37,"ESSO CO INTERNATIONAL PLOT # M-11-E 188,BLOCK -B, ST # 43,ROOM 2,46/C,2ND,FLOOR, DOGER TOWN MAIN BAZAR,BARKI RD,LHR",16511879.34,NEW PROSPECT GENERAL TRADING LLC UAE ,3,4397985.038,4,0
1445903.63,WAHAB INTERNATIONAL 124 BLOCK 01 SECTOR A 2 TOWNSHIP LAHORE,1445903.63,DEXIANG YIWU IMPORT AND EXPORT CO NO 1121 CHOUZHOU NORTH ROAD ROOM 2 ,17,,1,0
7480795.55,WAHAB INTERNATIONAL 124 BLOCK 01 SECTOR A 2 TOWNSHIP LAHORE,2493598.517,YIWU SUNSHIME IMP AND EXP CO LIMITED OFFICE 1011 JINMAO TOWER CHOUZHOU ROAD YIWU CITY ZHEJIANG CHINA,17,1333608.101,3,0
32044406.88,"AL KARAM PAPER MILLS PVT LTD IST FLOOR 257 WESTWOOD COLONY THOKAR NIAZ BAIG, RAIWIND ROAD LAHORE",16022203.44,GA PAPER INTERNATIONAL 327 RENFREW DRIVE SUITE 102 MARKHAM ONTARIO CANADA L3R 9S8,105,0,2,0
496097.78,SEA GOLD TRADERS HOUSE   A 296 BLOCK 5 GULSHAN E IQBAL KARACHI,496097.78,FOSHAN HEXIN CHUANGZHAN CERAMICS COMPANY LIMITED QING TONG DEVELOPMENT ZONE BAINI TOWNDISTRICTFOSHANCHINA,11,,1,0
1572318,SEA GOLD TRADERS HOUSE   A 296 BLOCK 5 GULSHAN E IQBAL KARACHI,1572318,FOSHAN STONE LIMITED HONGKONG ,11,,1,0
1584896.54,SEA GOLD TRADERS HOUSE   A 296 BLOCK 5 GULSHAN E IQBAL KARACHI,1584896.54,FUJIAN MINQING XINFENG CERAMIC CO GUIYAN TIANZHONG VILLAGE BAIZHONG TOWN MINQING FUJIAN CHINA ,11,,1,0
3438135.36,"AL MOMIN TRADING COMPANY OFFICE NO Z-1253/A MOHALLAH BABU LA L HUSSAIN ROAD DHOKE RATTA RAWALPINDI, PAKISTAN",3438135.36,QUANZHOU TDX ELECTRONICS CO LTD HI TECH QUANZHOU ECONOMIC AND DEVALOPMENT ZONE FUJIAN CHINA ,77,,1,0
14814432.61,"AL RAHEEM IMPEX OFFICE NO 7 ,II FLOOR,SADIQ  PALAZA CIRCULAR ROAD FAISALABAD ",2116347.516,AKID DYE CHEM UNIT 2 BEHIND JK BARREL NEAR CHANDOLA POLICE CHOWKI DANILIMDA AHMED ABAD 380 028 GUJRAT INDIA,106,1165201.24,7,0
733748.4,ALI OMER IMPORTER & EXPORTER H # 3 STREET # 1 MOHALLAH BAIT UL RAZA COLONEY YATEEM KHANNA CHOWK LAHORE,733748.4,BALRAM SRI SKRISHANA OVERSEAS S131099 2ND FLOOR BAZAR NARSING DASS NEAR BAZAR GANDANWALA AMRITSAR 143006 PUNJAB INDIA,51,,1,0
3668742,ALI OMER IMPORTER & EXPORTER H # 3 STREET # 1 MOHALLAH BAIT UL RAZA COLONEY YATEEM KHANNA CHOWK LAHORE,1834371,BATRA'S INTERNATIONAL A127 G FLR SECTOR 11 ROHNI DELHI INDIA ,51,0,2,0
1540871.64,ALI OMER IMPORTER & EXPORTER H # 3 STREET # 1 MOHALLAH BAIT UL RAZA COLONEY YATEEM KHANNA CHOWK LAHORE,1540871.64,SHIVANDITTA MAL AND COMPANY MAJITH MANDIAMRITSAR INDIA ,51,,1,0
21533918.06,"USMAN STEEL CASTING 15- KM, GT ROAD SHAMKE MURIDKE ",3588986.343,AIR GLOBAL FZC,15,1750602.589,6,0
447167.24,"USMAN STEEL CASTING 15- KM, GT ROAD SHAMKE MURIDKE ",447167.24,AL NIDHAM METAL TR LLC PO BOX 71993 SHARJAH UAE ,15,,1,0
2792279.54,"USMAN STEEL CASTING 15- KM, GT ROAD SHAMKE MURIDKE ",2792279.54,BAB AL RAYAN METAL SCRAP TR UAE ,15,,1,0
48179099.18,ARAMEX CRPORATION SUITE NO 149 CENTRAL PLAZA BARKET MARKET LAHORE ,16059699.73,GREAT FASHION TRADING LLC UAE ,3,8541829.285,3,0
28538253.04,ARAMEX CRPORATION SUITE NO 149 CENTRAL PLAZA BARKET MARKET LAHORE ,9512751.013,RICE TEK INTERNATIONAL GENERAL TRADING LLC UAE ,3,3652520.214,3,0
12094663.14,ARAMEX CRPORATION SUITE NO 149 CENTRAL PLAZA BARKET MARKET LAHORE ,12094663.14,SHANGHAI OCEAN SHIPPING SUPPLY CO LTD SHANGHAI CHINA ,3,,1,0
227418.72,CONTINENTIAL TRADING CORPORATION CONTINENTIAL TRADING CORP 3RD FLOOR GUL SHOPPING PLAZA BARKET MARKET NGT LAHORE,113709.36,REGELTEX ZI AVENUE JEAN BONNEFONT 36100 IS ,107,84260.65424,2,0
4499172.07,CONTINENTIAL TRADING CORPORATION CONTINENTIAL TRADING CORP 3RD FLOOR GUL SHOPPING PLAZA BARKET MARKET NGT LAHORE,4499172.07,SFE INTERNATIONAL 815B CHEMIN DU RAZASZI LES PLAINES 26780 MALATAVERNE FRANCE ,107,,1,0
230606.64,CONTINENTIAL TRADING CORPORATION CONTINENTIAL TRADING CORP 3RD FLOOR GUL SHOPPING PLAZA BARKET MARKET NGT LAHORE,230606.64,VANGUARD INSTRUMENTS COMPANY INC 1520 SOUTH HELLMAN AVENUE ONTARIO CA 91760 USA ,107,,1,0
522376.45,COUNTRY PAPER N BOARD MILLS PVT LTD COUNTRY PAPER N BOARD MILLS PVT LTD 17 KM FAISALABAD ROAD OLD BIKHI SHEIKHUPURA,522376.45,BEIJING TONGRUI SHENGCHANG TRADING NO54 YUNSHAN ROAD TONGZHOU INDUST ,108,,1,0
2825990.03,"UMAR TAXTILES OFFICE 30-2,C-1, GHOSIA CHOWK,COLLEGE ROAD, TOWN SHIP, LAHORE.",2825990.03,LONDON SILK GENERAL TRADING (Multiple),3,,1,0
73335347.57,"UMAR TAXTILES OFFICE 30-2,C-1, GHOSIA CHOWK,COLLEGE ROAD, TOWN SHIP, LAHORE.",12222557.93,NEW PROSPECT GENERAL TRADING LLC UAE ,3,2825684.255,6,0
11249872.4,"UMAR TAXTILES OFFICE 30-2,C-1, GHOSIA CHOWK,COLLEGE ROAD, TOWN SHIP, LAHORE.",11249872.4,SHAOXING COUNTY DUOFU IMP AND EXP CO LTD CHINA ,3,,1,0
761085.77,D.F.C. ENGINEERING CONCERN 23 A/8 WARIS ROAD LAHORE,761085.77,TRIDENT GLOBAL FZC SAIF ZONE EXECUTIVE DESK Q104 062 PO BOX 513041 SHARJAH UAE,109,,1,0
10479646.22,"UNIVET PHARMACEUTICALS., 14KM, ADYALA ROAD, POST OFFICE DAHGAL, RAWALPINDI, PAKISTAN. ",3493215.407,ARSHINE PHARMACEUTICAL CO LTD ROOM NO 1109 BLOCK C3 LUGU ENTERPRISE PLAZA NO 27 WENXUAN ROAD CHANGSHA NATIONAL HITECH,32,2273353.481,3,0
428456.66,"UNIVET PHARMACEUTICALS., 14KM, ADYALA ROAD, POST OFFICE DAHGAL, RAWALPINDI, PAKISTAN. ",428456.66,INFOARK CO LTD RM 810 NEW LAND PLAZA 58 FUCHENG ROAD HAIDIAN DISTRICT BEIJING CHINA,32,,1,0
3577023.45,AN NOOR IMPEX AN NOOR IMPEX  2064/B IST FLOOR INSIDE MORI GATE LAHORE. 032250000050,3577023.45,MS SHIVANDITTA MALL & COMPANY 303 TAGORE PARK EXTIN MODAL TOWN DEHLI INDIA ,51,,1,0
93268331.49,AN NOOR IMPEX AN NOOR IMPEX  2064/B IST FLOOR INSIDE MORI GATE LAHORE. 032250000050,2743186.22,SHIVANDITTA MAL AND COMPANY MAJITH MANDIAMRITSAR INDIA ,51,1157769.217,34,0
12741645.78,MALIK TRADERS MALIK HOUSE SHAHBAZ STREET KOT ABDUL MALIK SHEIKHUPURA,289582.8586,WATMORE TRADERS 30 PASIHENA RD WARAGODA KELANIYA SRILANKA ,110,94914.46224,44,0
1046272.81,"S M ENTERPRISES MUFTI TOWN LINK 40FT BAZA OPP PGC SIALKOT BYE PASS GUJRANWALA, PAKISTAN ",1046272.81,AGILE TRADE INTERNATIONAL INC 3150 ERIN CENTRE BLVD UNIT 126 MISSISSAUGA ON L5M7Z4 CANADA ,111,,1,0
41432934.64,"S M ENTERPRISES MUFTI TOWN LINK 40FT BAZA OPP PGC SIALKOT BYE PASS GUJRANWALA, PAKISTAN ",2180680.771,TRADE WAY IMPEX LLC 4034 SYDNEY CIRCLE DALTON GA 30721 ,111,1107629.69,19,0
9488834.31,M.IMTIAZ DALL MILL E-7 SITE AREA HYDERABAD ,9488834.31,AUSTRALIAN GRAIN EXPORT PTY LTD 12 ROBERT STREET MAITLAND SA 5573 AUSTRALIA,112,,1,0
6010943.41,M.IMTIAZ DALL MILL E-7 SITE AREA HYDERABAD ,6010943.41,GLENCORE GRAIN PTY LTD (Multiple),112,,1,0
9413955.28,M.IMTIAZ DALL MILL E-7 SITE AREA HYDERABAD ,9413955.28,GLOBEWAYS CANADA INC 2570 MATHESON BLVD E MISSISSAUGA ONTARIO L4W 4Z3 CANADA ,112,,1,0
917185.5,KHALID TRADERS SHOP NO 16A BILAL GANJ MARKET SARGODHA ROAD FAISALABAD ,917185.5,MIGHTY TRADING LTD HARPOLD STREET TIPTON DY4 0JE ENGLAND ,111,,1,0
1356805.61,KHALID TRADERS SHOP NO 16A BILAL GANJ MARKET SARGODHA ROAD FAISALABAD ,678402.805,NAEEM AND BROTHERS SDN BHD TAMAN MASTIARA JALAN IPOH KUALA LUMPUR ,111,59740.54573,2,0
4282470.13,KHALID TRADERS SHOP NO 16A BILAL GANJ MARKET SARGODHA ROAD FAISALABAD ,713745.0217,SHARP WAY ENTERPRISES UNIT 1109 11F RISE COMMERCIAL B ,111,102751.7367,6,0
7850278.74,"MS FINE HOUSE FINE HOUSE, CIRCULAR ROAD MOHALLAH DHAROWAL, SIALKOT SIALKOT 03216144114",2616759.58,FOSHAN CHAN CHENG JINYI CERAMICS CO GONGYE AVENUE NANZHUANG TOWN FOSHAN ,11,656125.2784,3,0
7200949.14,"MS FINE HOUSE FINE HOUSE, CIRCULAR ROAD MOHALLAH DHAROWAL, SIALKOT SIALKOT 03216144114",3600474.57,FUZHOU AONAV TRADE CO LTD NO206209 BUILDING 8 RONGCHENG S ,11,675495.8129,2,0
273941.82,M S MAINTALLOYS PRIVATE LTD 4TH FLOOR HAFEEZ CENTRE SHAHRA-E-FAISAL KARACHI,273941.82,E H WACHS COMPANY PO BOX 262543 FZS 5 AC 06 FREE ZONE SOUTH JEBEL ALI FREE ZONE DUBAI,113,,1,0
16830.87,M S SATA MACHINERY TRADERS 24 L G  BILAL CENTRE 9 NICHOLSON ROAD LAHORE PH 6373330 0303-7555002,16830.87,SEW EURO DRIVE GMBH AND CO (Multiple),102,,1,0
40477230.49,"PAKISTAN HERALD PUBLICATIONS (PRIVATE) LIMITED HAROON HOUSE, DR.ZIAUDDIN AHMED ROAD, KARACHI, PAKISTAN",20238615.25,KAMSONS MIDDLE EAST DMCC PO BOX 450125 DUBAI  UAE ,34,15355469.22,2,0
509563257.7,"PAKISTAN CABLES LTD., B/21, S.I.T.E. P.O. BOX 5050, KARACHI, PAKISTAN. ",56618139.74,GLENCORE GRAIN PTY LTD (Multiple),112,5147952.366,9,0
104818.06,MOON ENTERPRISES 117 ROSHAN PARK NEAR MULTAN CHUNGI MULTAN ROAD LAHORE LAHORE,104818.06,ALVIM SEIDEL ORQUIDARIO CATARINENSE LTDA BRAZIL ,114,,1,0
524100.76,MOON ENTERPRISES 117 ROSHAN PARK NEAR MULTAN CHUNGI MULTAN ROAD LAHORE DISTT LAHORE,524100.76,ALVIM SEIDEL ORQUIDARIO CATARINENSE LTDA BRAZIL ,114,,1,0
17048119.97,KANZO AG PLOT NO 09 INDUSTRIAL ESTATE PHASE II MULTAN PAKISTAN ,5682706.657,HEBEI BESTAR COMMERCE AND TRADE CO LTD FL NO 15 45 SOUTH TANGU ST SHIJIAZHUANG HEBEI CHINA ,12,1019919.075,3,0
3063923.68,"IMRAN AUTOS SHOP NO 137,BILAL GUNJ MARKET SARGODHA ROAD FAISALABAD 03006662918",765980.92,SHARP WAY ENTERPRISES UNIT 1109 11F RISE COMMERCIAL B ,111,326770.321,4,0
1477189.36,"PREMIER PAPER MILLS LTD P.O KOT SALEEM 8TH KM LAHORE ROAD PK SHEIKHUPURA,PAKISTAN",1477189.36,CORRFLEXO EK GRUNEWALDER STR 2931 42657 SOLINGEN GERMANY ,5,,1,0
1211822.64,"PREMIER PAPER MILLS LTD P.O KOT SALEEM 8TH KM LAHORE ROAD PK SHEIKHUPURA,PAKISTAN",605911.32,IBS AUSTRIA GMBH HAUPTSTRASSE 228833 TEUFENBACH AUSTRIA ,5,63473.18565,2,0
5450702.4,"PREMIUM ENTERPRISES PLOT NO-LY-238-23K QAZI ABDUL AZIZ ROAD, MOOSA LANE KARACHI.PAKISTAN",5450702.4,GIVAUDAN UK LTD KENNINGTON ROADASHFORD KENT TN24 OLT UNITED KINGDOM,96,,1,0
1788668.96,"PREMIUM ENTERPRISES PLOT NO-LY-238-23K QAZI ABDUL AZIZ ROAD, MOOSA LANE KARACHI.PAKISTAN",1788668.96,J AND C INDUSTRY CORPORATION COMPANY LIMITED RUIHUA BUILDING 315 ZHONGSHAN SOUTH ROADNANJING CHINA,96,,1,0
14368890.1,"PREMIUM ENTERPRISES PLOT NO-LY-238-23K QAZI ABDUL AZIZ ROAD, MOOSA LANE KARACHI.PAKISTAN",4789630.033,LIANGSHAN LINGHUA BIOTECHNOLOGY COLTD YOUTH ROAD 97 LIANGSHAN SHANDONGCHINA,96,434851.7745,3,0
183437.1,"NEOMEDIX., PLOT NO. 5, N/5, NATIONAL INDUSTRIAL ZONE RAWAT, ISLAMABAD, PAKISTAN.",183437.1,SS PHARMA EXPORTS B 205 VERTEX PRIDE APARTMENTS NIZAMPET ROAD KUKATPALLY HYDERABAD 72,115,,1,0
13419524.49,"IMRAN ENTERPRISES PLOT # 46//C,ROOM 1, 2CD FLOOR,DOGAGE TOWN,MAIN BAZAR, BARKI ROAD, LAHORE.",13419524.49,GREAT FASHION TRADING LLC UAE ,3,,1,0
45895962.42,"IMRAN ENTERPRISES PLOT # 46//C,ROOM 1, 2CD FLOOR,DOGAGE TOWN,MAIN BAZAR, BARKI ROAD, LAHORE.",22947981.21,LONDON SILK GENERAL TRADING (Multiple),3,667078.032,2,0
11593748.83,"IMRAN ENTERPRISES PLOT # 46//C,ROOM 1, 2CD FLOOR,DOGAGE TOWN,MAIN BAZAR, BARKI ROAD, LAHORE.",11593748.83,NEW PROSPECT GENERAL TRADING LLC UAE ,3,,1,0
8074639.09,IMPERIAL INDUSTRIES PVT LTD 8-9 N INDUSTRIAL AREA GULBERG II LAHORE opics,2691546.363,CHONGQING ASTONAUTIC BASHAN MOTORCYCLE MANUFACTURING CO LTD NO1 KANGCHAO RD BANAN DIST CHONGQING CHINA,116,1253566.976,3,0
2514975.05,IMPERIAL INDUSTRIES PVT LTD 8-9 N INDUSTRIAL AREA GULBERG II LAHORE opics,2514975.05,CHONGQING LONCIN IMPORT AND EXPORT CO LTD LONCIN AREA C 116 JUYE ROAD JIULONG INDUSTRIAL PARK AREA C JIULONGPO DIST CHONGQINGCHINA,116,,1,0
18261739.82,IMPERIAL INDUSTRIES PVT LTD 8-9 N INDUSTRIAL AREA GULBERG II LAHORE opics,3652347.964,FUTURE VISION GENERAL TRADING FZE OFFICE NO D1308 AJMAN FREE ZONE AJMAN UNITED ARAB EMIRATES ,116,1440421.134,5,0
518236.01,MUSHKO PRINTING SOLUTIONS PVT LTD 2ND FLOOR SAFA HOUSE ABDULLAH HAROON ROAD KARACHI,518236.01,HP PPS SINGAPORE SALES PTE LTD 450 ALEXANDRA ROAD SINGAPORE 119960,117,,1,0
8385696,MUSA ENTER PRISES HOUSE NO 124 MOHALLAH HASSAN PARWANA COLONY MULTAN,4192848,HUBEI XINGFA CHEMICALS GROUP COLTD A810 SANXIA SHANGCHENG 521 JIEFANG ROADYICHANGHUBEI 443000 CHINA ,96,0,2,0
21408681.88,MUSA ENTER PRISES HOUSE NO 124 MOHALLAH HASSAN PARWANA COLONY MULTAN,4281736.376,LIANGSHAN LINGHUA BIOTECHNOLOGY COLTD YOUTH ROAD 97 LIANGSHAN SHANDONGCHINA,96,301890.8802,5,0
14658196.6,MUSA ENTER PRISES HOUSE NO 124 MOHALLAH HASSAN PARWANA COLONY MULTAN,4886065.533,OCI SHANGHAI INTERNATIONAL TRADING LIMITED UNIT A11 12F VCAPITAL BUILDING NO333 XIAAXIA ROAD SHANGHAI CHINA,96,264466.0526,3,0
26895872.56,MUQADAS TOOLS COMPANY MUQADAS TOOLS COMPANY 33-BRANDERTH ROAD LAHORE.03214167077 ,2068913.274,YIWU SUNSHIME IMP AND EXP CO LIMITED OFFICE 1011 JINMAO TOWER CHOUZHOU ROAD YIWU CITY ZHEJIANG CHINA,17,538885.4453,13,0
13303628.94,LANCER SURGICAL CO LANCER SURGICAL CO. 147 C FATIMA JINNAH ROAD SIE SIALKOT,1330362.894,YKK PAKISTAN PVT LTD PLOT 123 SECTOR EI AND EII KARACHI EXPORT PROCESSING ZONE MEHRAN HIGHWAY LANDHI PAKISTAN,8,894212.269,10,0
46235373.46,"ICT TECH OFFICE NO.31,TIMBER POND, KEMARI,KARACHI.PAKISTAN ",3852947.788,COMPUTER RECYCLERS USA LLC 6395 MCDONOUGH DRIVE SUITE B NORCROSS GA30093 USA,73,1389377.116,12,0
31284725.72,"ICT TECH OFFICE NO.31,TIMBER POND, KEMARI,KARACHI.PAKISTAN ",3128472.572,SOUTHEAST IT ASSET RECOVERY LLC 5215 BEECHAM COURT SUWANEE GA30024 USA,73,503905.9474,10,0
161992797.8,"KHAN BABA TRADING CO 4 NIL -B-2, BLOCK 6 CIVIL DEFENCE ROAD TOWN SHIP LAHORE ",6749699.908,SICHUAN NEW RISE IMP AND EXP CO LTD NO182 JIANGHAN ROAD CHENGDU SICHUAN CHINA ,118,4562204.766,24,0
5248292.66,"HYSEN ENGINEERING WORKS (PVT) LTD PLOT NO.251-255,EBRAHIM HYDERI, KORANGI CREEK, KARACHI,PAKISTAN ",2624146.33,CHONGQING MINGHAN CO LTD A3505 HONGDING INT'L MANSION JIANGBEI DISTRICT CHONGQING CHINA,119,476664.3157,2,0
